{
  "$schema": "http://json-schema.org/draft-07/schema#",
  "additionalProperties": false,
  "definitions": {
    "ComplexColor": {
      "additionalProperties": false,
      "description": "Represents a complex color that has a base, light and dark value.",
      "properties": {
        "darker": {
          "description": "Type for a color. Used for readability purpose.",
          "pattern": "^(#[A-Fa-f0-9]{6}|transparent|rgba\\((\\d+(\\.\\d+)?,){3}(\\d+(\\.\\d+)?)\\))$",
          "type": "string"
        },
        "default": {
          "description": "Type for a color. Used for readability purpose.",
          "pattern": "^(#[A-Fa-f0-9]{6}|transparent|rgba\\((\\d+(\\.\\d+)?,){3}(\\d+(\\.\\d+)?)\\))$",
          "type": "string"
        },
        "lighter": {
          "description": "Type for a color. Used for readability purpose.",
          "pattern": "^(#[A-Fa-f0-9]{6}|transparent|rgba\\((\\d+(\\.\\d+)?,){3}(\\d+(\\.\\d+)?)\\))$",
          "type": "string"
        }
      },
      "required": ["darker", "default", "lighter"],
      "type": "object"
    },
    "Easing": {
      "enum": ["ease-in", "ease-in-out", "ease-out"],
      "type": "string"
    },
    "FontSize": {
      "additionalProperties": false,
      "properties": {
        "height": {
          "type": "number"
        },
        "size": {
          "type": "number"
        }
      },
      "required": ["height", "size"],
      "type": "object"
    },
    "FontWeight": {
      "description": "Type for a font-weight.",
      "enum": ["100", "200", "300", "400", "500", "600", "700", "800", "900", "bold", "normal"],
      "type": "string"
    }
  },
  "description": "Structure of a Theme.",
  "properties": {
    "$schema": {
      "type": "string"
    },
    "animation": {
      "additionalProperties": false,
      "properties": {
        "duration": {
          "additionalProperties": false,
          "properties": {
            "default": {
              "type": "number"
            },
            "longer": {
              "type": "number"
            },
            "shorter": {
              "type": "number"
            }
          },
          "required": ["default", "longer", "shorter"],
          "type": "object"
        },
        "easing": {
          "additionalProperties": false,
          "properties": {
            "enter": {
              "$ref": "#/definitions/Easing"
            },
            "exit": {
              "$ref": "#/definitions/Easing"
            },
            "move": {
              "$ref": "#/definitions/Easing"
            }
          },
          "required": ["enter", "exit", "move"],
          "type": "object"
        }
      },
      "required": ["duration", "easing"],
      "type": "object"
    },
    "border": {
      "additionalProperties": false,
      "properties": {
        "none": {
          "type": "number"
        },
        "small": {
          "type": "number"
        },
        "thinner": {
          "type": "number"
        }
      },
      "required": ["none", "small", "thinner"],
      "type": "object"
    },
    "colors": {
      "additionalProperties": false,
      "properties": {
        "destructive": {
          "description": "Type for a color. Used for readability purpose.",
          "pattern": "^(#[A-Fa-f0-9]{6}|transparent|rgba\\((\\d+(\\.\\d+)?,){3}(\\d+(\\.\\d+)?)\\))$",
          "type": "string"
        },
        "fill": {
          "additionalProperties": false,
          "properties": {
            "accent": {
              "$ref": "#/definitions/ComplexColor"
            },
            "accentSecondary": {
              "$ref": "#/definitions/ComplexColor"
            },
            "background": {
              "additionalProperties": false,
              "properties": {
                "darker": {
                  "description": "Type for a color. Used for readability purpose.",
                  "pattern": "^(#[A-Fa-f0-9]{6}|transparent|rgba\\((\\d+(\\.\\d+)?,){3}(\\d+(\\.\\d+)?)\\))$",
                  "type": "string"
                },
                "default": {
                  "description": "Type for a color. Used for readability purpose.",
                  "pattern": "^(#[A-Fa-f0-9]{6}|transparent|rgba\\((\\d+(\\.\\d+)?,){3}(\\d+(\\.\\d+)?)\\))$",
                  "type": "string"
                },
                "inverse": {
                  "description": "Type for a color. Used for readability purpose.",
                  "pattern": "^(#[A-Fa-f0-9]{6}|transparent|rgba\\((\\d+(\\.\\d+)?,){3}(\\d+(\\.\\d+)?)\\))$",
                  "type": "string"
                },
                "lighter": {
                  "description": "Type for a color. Used for readability purpose.",
                  "pattern": "^(#[A-Fa-f0-9]{6}|transparent|rgba\\((\\d+(\\.\\d+)?,){3}(\\d+(\\.\\d+)?)\\))$",
                  "type": "string"
                }
              },
              "required": ["darker", "default", "inverse", "lighter"],
              "type": "object"
            },
            "divider": {
              "$ref": "#/definitions/ComplexColor"
            },
            "primary": {
              "$ref": "#/definitions/ComplexColor"
            }
          },
          "required": ["accent", "accentSecondary", "background", "divider", "primary"],
          "type": "object"
        },
        "negative": {
          "description": "Type for a color. Used for readability purpose.",
          "pattern": "^(#[A-Fa-f0-9]{6}|transparent|rgba\\((\\d+(\\.\\d+)?,){3}(\\d+(\\.\\d+)?)\\))$",
          "type": "string"
        },
        "positive": {
          "description": "Type for a color. Used for readability purpose.",
          "pattern": "^(#[A-Fa-f0-9]{6}|transparent|rgba\\((\\d+(\\.\\d+)?,){3}(\\d+(\\.\\d+)?)\\))$",
          "type": "string"
        },
        "status": {
          "additionalProperties": false,
          "properties": {
            "error": {
              "description": "Type for a color. Used for readability purpose.",
              "pattern": "^(#[A-Fa-f0-9]{6}|transparent|rgba\\((\\d+(\\.\\d+)?,){3}(\\d+(\\.\\d+)?)\\))$",
              "type": "string"
            },
            "success": {
              "$ref": "#/definitions/ComplexColor"
            },
            "warning": {
              "description": "Type for a color. Used for readability purpose.",
              "pattern": "^(#[A-Fa-f0-9]{6}|transparent|rgba\\((\\d+(\\.\\d+)?,){3}(\\d+(\\.\\d+)?)\\))$",
              "type": "string"
            }
          },
          "required": ["error", "success", "warning"],
          "type": "object"
        },
        "text": {
          "additionalProperties": false,
          "properties": {
            "accent": {
              "description": "Type for a color. Used for readability purpose.",
              "pattern": "^(#[A-Fa-f0-9]{6}|transparent|rgba\\((\\d+(\\.\\d+)?,){3}(\\d+(\\.\\d+)?)\\))$",
              "type": "string"
            },
            "inverse": {
              "description": "Type for a color. Used for readability purpose.",
              "pattern": "^(#[A-Fa-f0-9]{6}|transparent|rgba\\((\\d+(\\.\\d+)?,){3}(\\d+(\\.\\d+)?)\\))$",
              "type": "string"
            },
            "primary": {
              "description": "Type for a color. Used for readability purpose.",
              "pattern": "^(#[A-Fa-f0-9]{6}|transparent|rgba\\((\\d+(\\.\\d+)?,){3}(\\d+(\\.\\d+)?)\\))$",
              "type": "string"
            },
            "subdued": {
              "description": "Type for a color. Used for readability purpose.",
              "pattern": "^(#[A-Fa-f0-9]{6}|transparent|rgba\\((\\d+(\\.\\d+)?,){3}(\\d+(\\.\\d+)?)\\))$",
              "type": "string"
            }
          },
          "required": ["accent", "inverse", "primary", "subdued"],
          "type": "object"
        },
        "transparent": {
          "description": "Type for a color. Used for readability purpose.",
          "pattern": "^(#[A-Fa-f0-9]{6}|transparent|rgba\\((\\d+(\\.\\d+)?,){3}(\\d+(\\.\\d+)?)\\))$",
          "type": "string"
        }
      },
      "required": ["destructive", "fill", "negative", "positive", "status", "text", "transparent"],
      "type": "object"
    },
    "elevation": {
      "additionalProperties": false,
      "properties": {
        "z0": {
          "additionalProperties": false,
          "description": "Type representing an Elevation.",
          "properties": {
            "elevation": {
              "description": "Sets the elevation of a view, using Android's underlying\n[elevation API](https://developer.android.com/training/material/shadows-clipping.html#Elevation).\nThis adds a drop shadow to the item and affects z-order for overlapping views.\nOnly supported on Android 5.0+, has no effect on earlier versions.",
              "type": "number"
            },
            "shadowColor": {
              "type": "string"
            },
            "shadowOffset": {
              "additionalProperties": false,
              "properties": {
                "height": {
                  "type": "number"
                },
                "width": {
                  "type": "number"
                }
              },
              "required": ["height", "width"],
              "type": "object"
            },
            "shadowOpacity": {
              "type": "number"
            },
            "shadowRadius": {
              "type": "number"
            }
          },
          "required": ["elevation"],
          "type": "object"
        },
        "z2": {
          "additionalProperties": false,
          "description": "Type representing an Elevation.",
          "properties": {
            "elevation": {
              "description": "Sets the elevation of a view, using Android's underlying\n[elevation API](https://developer.android.com/training/material/shadows-clipping.html#Elevation).\nThis adds a drop shadow to the item and affects z-order for overlapping views.\nOnly supported on Android 5.0+, has no effect on earlier versions.",
              "type": "number"
            },
            "shadowColor": {
              "type": "string"
            },
            "shadowOffset": {
              "additionalProperties": false,
              "properties": {
                "height": {
                  "type": "number"
                },
                "width": {
                  "type": "number"
                }
              },
              "required": ["height", "width"],
              "type": "object"
            },
            "shadowOpacity": {
              "type": "number"
            },
            "shadowRadius": {
              "type": "number"
            }
          },
          "required": ["elevation"],
          "type": "object"
        },
        "z4": {
          "additionalProperties": false,
          "description": "Type representing an Elevation.",
          "properties": {
            "elevation": {
              "description": "Sets the elevation of a view, using Android's underlying\n[elevation API](https://developer.android.com/training/material/shadows-clipping.html#Elevation).\nThis adds a drop shadow to the item and affects z-order for overlapping views.\nOnly supported on Android 5.0+, has no effect on earlier versions.",
              "type": "number"
            },
            "shadowColor": {
              "type": "string"
            },
            "shadowOffset": {
              "additionalProperties": false,
              "properties": {
                "height": {
                  "type": "number"
                },
                "width": {
                  "type": "number"
                }
              },
              "required": ["height", "width"],
              "type": "object"
            },
            "shadowOpacity": {
              "type": "number"
            },
            "shadowRadius": {
              "type": "number"
            }
          },
          "required": ["elevation"],
          "type": "object"
        },
        "z8": {
          "additionalProperties": false,
          "description": "Type representing an Elevation.",
          "properties": {
            "elevation": {
              "description": "Sets the elevation of a view, using Android's underlying\n[elevation API](https://developer.android.com/training/material/shadows-clipping.html#Elevation).\nThis adds a drop shadow to the item and affects z-order for overlapping views.\nOnly supported on Android 5.0+, has no effect on earlier versions.",
              "type": "number"
            },
            "shadowColor": {
              "type": "string"
            },
            "shadowOffset": {
              "additionalProperties": false,
              "properties": {
                "height": {
                  "type": "number"
                },
                "width": {
                  "type": "number"
                }
              },
              "required": ["height", "width"],
              "type": "object"
            },
            "shadowOpacity": {
              "type": "number"
            },
            "shadowRadius": {
              "type": "number"
            }
          },
          "required": ["elevation"],
          "type": "object"
        }
      },
      "required": ["z0", "z2", "z4", "z8"],
      "type": "object"
    },
    "font": {
      "additionalProperties": false,
      "properties": {
        "family": {
          "description": "Type for a font-family. Used for readability purpose.",
          "type": "string"
        },
        "size": {
          "additionalProperties": false,
          "properties": {
            "large": {
              "$ref": "#/definitions/FontSize"
            },
            "regular": {
              "$ref": "#/definitions/FontSize"
            },
            "small": {
              "$ref": "#/definitions/FontSize"
            }
          },
          "required": ["large", "regular", "small"],
          "type": "object"
        },
        "weights": {
          "additionalProperties": false,
          "properties": {
            "regular": {
              "$ref": "#/definitions/FontWeight"
            },
            "strong": {
              "$ref": "#/definitions/FontWeight"
            }
          },
          "required": ["regular", "strong"],
          "type": "object"
        }
      },
      "required": ["family", "size", "weights"],
      "type": "object"
    },
    "opacity": {
      "additionalProperties": false,
      "properties": {
        "disabled": {
          "type": "number"
        }
      },
      "required": ["disabled"],
      "type": "object"
    },
    "radius": {
      "additionalProperties": false,
      "properties": {
        "circle": {
          "type": "number"
        },
        "large": {
          "type": "number"
        },
        "medium": {
          "type": "number"
        },
        "none": {
          "type": "number"
        },
        "small": {
          "type": "number"
        }
      },
      "required": ["circle", "large", "medium", "none", "small"],
      "type": "object"
    },
    "size": {
      "additionalProperties": false,
      "properties": {
        "avatar": {
          "additionalProperties": false,
          "properties": {
            "default": {
              "type": "number"
            },
            "small": {
              "type": "number"
            }
          },
          "required": ["default", "small"],
          "type": "object"
        },
        "bullet": {
          "type": "number"
        },
        "divider": {
          "type": "number"
        },
        "icon": {
          "additionalProperties": false,
          "properties": {
            "default": {
              "type": "number"
            },
            "large": {
              "type": "number"
            },
            "small": {
              "type": "number"
            },
            "xLarge": {
              "type": "number"
            }
          },
          "required": ["default", "large", "small", "xLarge"],
          "type": "object"
        },
        "minTouchArea": {
          "type": "number"
        }
      },
      "required": ["avatar", "bullet", "divider", "icon", "minTouchArea"],
      "type": "object"
    },
    "spacing": {
      "additionalProperties": false,
      "properties": {
        "large": {
          "type": "number"
        },
        "medium": {
          "type": "number"
        },
        "none": {
          "type": "number"
        },
        "small": {
          "type": "number"
        },
        "xLarge": {
          "type": "number"
        },
        "xSmall": {
          "type": "number"
        },
        "xxLarge": {
          "type": "number"
        }
      },
      "required": ["large", "medium", "none", "small", "xLarge", "xSmall", "xxLarge"],
      "type": "object"
    }
  },
  "required": [
    "$schema",
    "animation",
    "border",
    "colors",
    "elevation",
    "font",
    "opacity",
    "radius",
    "size",
    "spacing"
  ],
  "type": "object"
}
